timestamp,project_id,project,event_type,reason,precision,added,modified,deleted,sample_files
2026-02-05T02:02:55-06:00,aparment,APARMENT (Renta IA Hub),historical_activity,initial_backfill,estimated,0,16,0,apartament22 desarrollo/.env.local; apartament22 desarrollo/.gitignore; apartament22 desarrollo/App.tsx; apartament22 desarrollo/README.md
2026-02-05T01:23:45-06:00,couplepay,Couplepay 💳,historical_activity,initial_backfill,estimated,0,27,0,desarrollo/.env.local; desarrollo/.gitignore; desarrollo/App.tsx; desarrollo/README.md
2026-02-05T02:35:44-06:00,medicia,MedicIA 🏥,historical_activity,initial_backfill,estimated,0,26,0,.env.local; .gitignore; App.tsx; README.md
2026-02-05T23:08:41-06:00,nutriflow,NUTRIFLOW,historical_activity,initial_backfill,estimated,0,56,0,desarrollo/.env.local; desarrollo/.gitignore; desarrollo/App.tsx; desarrollo/README.md
2026-02-05T02:13:15-06:00,prismacraft,PrismaCraft 🎨,historical_activity,initial_backfill,estimated,0,28,0,desarrollo/.env.local; desarrollo/.gitignore; desarrollo/App.tsx; desarrollo/README.md
2026-02-05T01:39:17-06:00,prompt-ia,Prompt-IA ⌨️,historical_activity,initial_backfill,estimated,0,16,0,desarrollo promptptia/.env.local; desarrollo promptptia/.gitignore; desarrollo promptptia/App.tsx; desarrollo promptptia/README.md
2026-02-05T02:26:05-06:00,punkped-ia,Punkped-IA,historical_activity,initial_backfill,estimated,0,15,0,.env.local; .gitignore; App.tsx; README.md
2026-02-05T23:12:33-06:00,volt-ia,VOLT-IA,historical_activity,initial_backfill,estimated,0,24,0,.env.local; .gitignore; App.tsx; README.md
2026-02-05T01:50:06-06:00,proyectia,PROYECTIA (Command Center),historical_activity,initial_backfill,estimated,0,34,0,info vieja/15_Proyectia/Brand_Identity/por no considerar/desarrollo/.env.local; info vieja/15_Proyectia/Brand_Identity/por no considerar/desarrollo/.gitignore; info vieja/15_Proyectia/Brand_Identity/por no considerar/desarrollo/App.tsx; info vieja/15_Proyectia/Brand_Identity/por no considerar/desarrollo/components/AnimatedGrid.tsx
2026-02-05T22:27:52-06:00,reflectia,REFLECTIA (Luxury Simulation),historical_activity,initial_backfill,estimated,0,21,0,desarrollo/.env.local; desarrollo/.gitignore; desarrollo/App.tsx; desarrollo/README.md
2026-02-05T20:30:10-06:00,retriver,Retriver,historical_activity,initial_backfill,estimated,0,4,0,Retriever/Database/Daniel/CV/LINKEDIN_OPTIMIZATION_KIT.md; Retriever/Database/Daniel/CV/datos nuevos openai/chat_history_completo.md; Retriever/Database/Daniel/CV/datos nuevos openai/chatgeneral.md; Retriever/Database/Daniel/perfilprofesional.md
2026-02-05T21:11:35-06:00,visual-ia-suite,Visual Ia Suite,historical_activity,initial_backfill,estimated,0,18,0,.env.local; .gitignore; App.tsx; README.md
2026-02-05T16:48:35-06:00,voyager-files,Voyager Files,historical_activity,initial_backfill,estimated,0,1,0,desarrollo/🦊-voyager-file-explorer.zip
